{
  "schemaVersion": 1,
  "artifactKind": "model-manifest-admission",
  "sourceAdmission": {
    "fileName": "release-source-admission-v3.json",
    "sizeBytes": 1939,
    "sha256": "6c4a7641a0a4cb20dfe52f39f9ef8fc12d8d8dae6eddea8b8eff9f66b1afbca8"
  },
  "profiles": [
    {
      "profileId": "chinese",
      "manifest": {
        "fileName": "voice-model-chinese-fun-asr-nano-gguf-q8-v1.json",
        "sizeBytes": 2801,
        "sha256": "09bf363a22ff7c98e53945e51544da09af0a96a7ad996b6ff991ef782a83c4da"
      },
      "modelAdmissionRootSha256": "7a49df7e07d907818a02e3f5f12a58c47b5116d5e9deb2fd67caad1dcc97f0a8",
      "executionClosureVerification": {
        "fileName": "chinese-profile-execution-closure-v2.json",
        "sizeBytes": 1426,
        "sha256": "ed769548601482f1672a7e1a3a6c863f4d9a5c05d9d54a8ce93c322dbc8f3341"
      },
      "branchProjectionSha256": "240b909f1e64c106a6e65e4572cd756816777dd8114f33b5235a5edd00aa691f",
      "decision": "admitted"
    },
    {
      "profileId": "english",
      "manifest": {
        "fileName": "voice-model-english-whisper-small-mlx-fp16-v1.json",
        "sizeBytes": 2335,
        "sha256": "623ad1e90eb305e703f09a15e2325be2026aa39dea98bb34f1859ac953836593"
      },
      "modelAdmissionRootSha256": "7cbf9799670b42482a29404c7a2acfb3a7f701a5e890d3cc22f3245bddfb5448",
      "executionClosureVerification": {
        "fileName": "english-profile-execution-closure-v2.json",
        "sizeBytes": 1454,
        "sha256": "1f105d7b8af89332b946d7788e59c8597291f76bc51dc663dee1bce91ca73862"
      },
      "branchProjectionSha256": "240b909f1e64c106a6e65e4572cd756816777dd8114f33b5235a5edd00aa691f",
      "decision": "admitted"
    }
  ],
  "decision": "pass"
}
